{
  "title": "跨设备云端 Agent 办公系统架构全景图",
  "subtitle": "跨设备 · 长期记忆 · 工具调用 · 知识沉淀 · 多 Agent 协作",
  "diagram_type": "system-architecture",
  "layout": "board",
  "theme": "paper",
  "brand": {"name": "DiagramSkills", "primary": "#246BCE", "accent": "#6D3BC3"},
  "sections": [
    {
      "id": "devices",
      "label": "使用设备 / Agent",
      "subtitle": "WHO USES THE SYSTEM",
      "tone": "blue",
      "blocks": [
        {
          "id": "device-grid",
          "kind": "grid",
          "title": "跨设备与 Agent 入口",
          "columns": 5,
          "cards": [
            {"id": "phone", "label": "手机", "subtitle": "ChatGPT App", "icon": "phone"},
            {"id": "macbook", "label": "MacBook", "subtitle": "ChatGPT / Codex", "icon": "laptop"},
            {"id": "windows", "label": "Windows PC", "subtitle": "ChatGPT / Codex", "icon": "desktop"},
            {"id": "codex", "label": "Codex CLI", "subtitle": "终端 / 命令行", "icon": "terminal"},
            {"id": "other-agent", "label": "其他 Agent", "subtitle": "Claude / Cursor / 自建", "icon": "agent"}
          ]
        }
      ]
    },
    {
      "id": "access",
      "label": "接入层",
      "subtitle": "MCP / API",
      "tone": "purple",
      "blocks": [
        {"id": "gateway", "kind": "banner", "title": "Memory MCP / API 网关", "subtitle": "统一认证 · 权限控制 · 请求路由 · 限流 · 日志", "icon": "gateway"}
      ]
    },
    {
      "id": "memory",
      "label": "记忆层",
      "subtitle": "BASIC MEMORY CLOUD",
      "tone": "green",
      "blocks": [
        {
          "id": "memory-core",
          "kind": "grid",
          "title": "Basic Memory Cloud（Agent 的长期记忆大脑）",
          "columns": 4,
          "span": 4,
          "cards": [
            {"id": "notes", "label": "Markdown 笔记", "subtitle": "结构化存储", "icon": "note"},
            {"id": "search", "label": "语义 / 向量搜索", "subtitle": "Semantic / Vector / Hybrid", "icon": "search"},
            {"id": "knowledge", "label": "知识图谱", "subtitle": "Graph / Relations", "icon": "graph"},
            {"id": "context", "label": "上下文构建", "subtitle": "Build Context", "icon": "brain"},
            {"id": "recent", "label": "最近活动", "subtitle": "Recent Activity", "icon": "calendar"},
            {"id": "schema", "label": "Schema 管理", "subtitle": "Infer / Validate / Diff", "icon": "schema"},
            {"id": "workspace", "label": "多项目 / 工作区", "subtitle": "Project / Workspace", "icon": "folder"},
            {"id": "relations", "label": "关系管理", "subtitle": "Relations / Metadata", "icon": "sync"}
          ],
          "footer": "统一索引层（全文索引 + 向量索引 + 元数据）"
        },
        {
          "id": "memory-examples",
          "kind": "list",
          "title": "Memory 中典型内容",
          "span": 1,
          "items": ["个人偏好与身份", "公司 / 团队 / 角色", "产品原则与决策记录", "项目背景与需求上下文", "会议结论与跟进事项", "SOP / 工作规范 / Prompt", "长期待办与 Follow-up"]
        }
      ]
    },
    {
      "id": "integrations",
      "label": "集成层",
      "subtitle": "TOOLS / SYSTEMS",
      "tone": "orange",
      "blocks": [
        {
          "id": "integration-tools",
          "kind": "grid",
          "title": "外部工具与业务系统",
          "columns": 7,
          "cards": [
            {"id": "drive", "label": "Google Drive", "subtitle": "文档 / 资料", "icon": "cloud"},
            {"id": "gmail", "label": "Gmail", "subtitle": "邮件", "icon": "mail"},
            {"id": "gcalendar", "label": "Google Calendar", "subtitle": "日程 / 会议", "icon": "calendar"},
            {"id": "slack", "label": "Slack / 飞书", "subtitle": "沟通 / 消息", "icon": "chat"},
            {"id": "figma", "label": "Figma", "subtitle": "设计文件", "icon": "image"},
            {"id": "notion", "label": "Notion", "subtitle": "部分知识库", "icon": "note"},
            {"id": "more-tools", "label": "更多工具", "subtitle": "Jira / Linear / API", "icon": "api"}
          ]
        }
      ]
    },
    {
      "id": "assets",
      "label": "资产层",
      "subtitle": "SOURCE OF TRUTH",
      "tone": "blue",
      "blocks": [
        {
          "id": "github-assets",
          "kind": "grid",
          "title": "GitHub（代码 / 版本 / 工程资产）",
          "columns": 3,
          "span": 2,
          "cards": [
            {"id": "repos", "label": "代码仓库", "subtitle": "Agent / Skill / 工具", "icon": "code"},
            {"id": "rfc", "label": "文档 / RFC", "subtitle": "技术方案 / 设计文档", "icon": "document"},
            {"id": "prompts", "label": "Prompt / SOP", "subtitle": "版本管理 / 迭代", "icon": "prompt"},
            {"id": "scripts", "label": "Scripts / 配置", "subtitle": "自动化脚本 / YAML", "icon": "terminal"},
            {"id": "tests", "label": "测试 / 数据", "subtitle": "测试用例 / 数据集", "icon": "test"},
            {"id": "history", "label": "版本历史", "subtitle": "Git / PR / Review", "icon": "archive"}
          ]
        },
        {
          "id": "file-assets",
          "kind": "grid",
          "title": "其他文件存储（大文件 / 原始资料）",
          "columns": 2,
          "span": 2,
          "cards": [
            {"id": "source-docs", "label": "原始文档", "subtitle": "需求 / PRD / 资料", "icon": "document"},
            {"id": "datasets", "label": "数据文件", "subtitle": "数据集 / 分析结果", "icon": "database"},
            {"id": "media", "label": "图片 / 媒体", "subtitle": "截图 / 录屏 / 图片", "icon": "image"},
            {"id": "backups", "label": "备份 / 归档", "subtitle": "历史版本 / 备份", "icon": "archive"}
          ]
        },
        {
          "id": "layer-rationale",
          "kind": "list",
          "title": "为什么分层？",
          "span": 1,
          "items": ["Memory = 高价值上下文", "GitHub = 版本化工程资产", "Drive = 大文件与原始资料", "工具 = 实时信息与能力", "Agent 只读取所需上下文"]
        }
      ]
    }
  ],
  "connections": [
    {"source": "phone", "target": "gateway", "kind": "primary"},
    {"source": "macbook", "target": "gateway", "kind": "primary"},
    {"source": "windows", "target": "gateway", "kind": "primary"},
    {"source": "codex", "target": "gateway", "kind": "primary"},
    {"source": "other-agent", "target": "gateway", "kind": "primary"},
    {"source": "gateway", "target": "memory-core", "kind": "feedback", "bidirectional": true},
    {"source": "memory-core", "target": "memory-examples", "kind": "success"},
    {"source": "memory-core", "target": "integration-tools", "kind": "success", "bidirectional": true},
    {"source": "integration-tools", "target": "github-assets", "kind": "control", "bidirectional": true},
    {"source": "integration-tools", "target": "file-assets", "kind": "control", "bidirectional": true}
  ],
  "flow": {
    "label": "数据流向说明",
    "tone": "amber",
    "steps": [
      {"label": "Agent 发起请求", "subtitle": "需要上下文 / 记忆", "icon": "robot"},
      {"label": "Memory 检索", "subtitle": "搜索相关记忆", "icon": "search"},
      {"label": "构建上下文", "subtitle": "组装最相关信息", "icon": "brain"},
      {"label": "Agent 执行任务", "subtitle": "调用工具 / 生成决策", "icon": "agent"},
      {"label": "写入更新记忆", "subtitle": "决策 / 结论 / 经验", "icon": "note"},
      {"label": "同步到各层", "subtitle": "Memory / GitHub / 工具", "icon": "cloud"}
    ]
  },
  "principles": [
    {"label": "记忆最小化", "subtitle": "只保存长期有价值的信息", "icon": "brain"},
    {"label": "上下文精准", "subtitle": "只读取与当前任务相关内容", "icon": "search"},
    {"label": "单一事实来源", "subtitle": "重要事实在一个地方维护", "icon": "document"},
    {"label": "持续进化", "subtitle": "定期清理、更新与合并记忆", "icon": "sync"},
    {"label": "隐私安全", "subtitle": "权限控制与敏感信息保护", "icon": "lock"}
  ]
}
